{"$schema":"https://json-schema.org/draft/2020-12/schema","$id":"urn:cml:mcp:caep:0.1.0","title":"Portable Causal Action Episode (CAEP)","description":"Experimental CML/MCP execution-record profile. It records externally auditable intent, authorization, state transition, verification, recovery, and digest-bound causal lineage without private chain-of-thought.","type":"object","required":["profile","schema_version","episode_id","workflow_id","status","causal_parent_ids","intent","authorization","decision","state_before","action","time","integrity"],"properties":{"profile":{"const":"org.causal-memory-layer.caep"},"schema_version":{"const":"0.1.0"},"episode_id":{"$ref":"#/$defs/id"},"workflow_id":{"$ref":"#/$defs/id"},"status":{"enum":["planned","blocked","dispatched","completed","verified","contained","recovered"]},"causal_parent_ids":{"type":"array","items":{"$ref":"#/$defs/id"},"uniqueItems":true},"supersedes":{"type":"array","items":{"$ref":"#/$defs/id"},"uniqueItems":true,"default":[]},"intent":{"$ref":"#/$defs/intent"},"authorization":{"$ref":"#/$defs/authorization"},"decision":{"$ref":"#/$defs/decision"},"state_before":{"type":"array","items":{"$ref":"#/$defs/artifact"},"minItems":1},"action":{"$ref":"#/$defs/action"},"expected_postconditions":{"type":"array","items":{"$ref":"#/$defs/postcondition"},"default":[]},"outcome":{"$ref":"#/$defs/outcome"},"state_after":{"type":"array","items":{"$ref":"#/$defs/artifact"},"default":[]},"verification":{"$ref":"#/$defs/verification"},"recovery":{"$ref":"#/$defs/recovery"},"time":{"$ref":"#/$defs/time"},"integrity":{"$ref":"#/$defs/integrity"},"privacy":{"$ref":"#/$defs/privacy"},"extensions":{"type":"object","additionalProperties":true,"default":{}}},"allOf":[{"if":{"required":["status"],"properties":{"status":{"const":"blocked"}}},"then":{"properties":{"authorization":{"required":["decision"],"properties":{"decision":{"const":"denied"}}},"action":{"required":["dispatch"],"properties":{"dispatch":{"type":"null"}}}}}},{"if":{"required":["status"],"properties":{"status":{"enum":["dispatched","completed","verified","contained","recovered"]}}},"then":{"required":["outcome"],"properties":{"action":{"required":["dispatch"],"properties":{"dispatch":{"$ref":"#/$defs/dispatch"}}}}}},{"if":{"required":["status"],"properties":{"status":{"enum":["verified","contained","recovered"]}}},"then":{"required":["verification"],"properties":{"state_after":{"minItems":1}}}},{"if":{"required":["status"],"properties":{"status":{"const":"verified"}}},"then":{"properties":{"verification":{"required":["verdict"],"properties":{"verdict":{"const":"verified"}}}}}},{"if":{"required":["status"],"properties":{"status":{"const":"contained"}}},"then":{"required":["recovery"],"properties":{"verification":{"required":["verdict"],"properties":{"verdict":{"enum":["diverged","inconclusive"]}}},"recovery":{"required":["status"],"properties":{"status":{"const":"contained"}}}}}},{"if":{"required":["status"],"properties":{"status":{"const":"recovered"}}},"then":{"required":["recovery"],"properties":{"verification":{"required":["verdict"],"properties":{"verdict":{"const":"verified"}}},"recovery":{"required":["status"],"properties":{"status":{"const":"recovered"}}}}}},{"if":{"required":["action"],"properties":{"action":{"required":["side_effect"],"properties":{"side_effect":{"enum":["local_write","external_write","destructive"]}}}}},"then":{"required":["recovery"],"properties":{"authorization":{"required":["decision"],"properties":{"decision":{"const":"authorized"}}}}}}],"additionalProperties":false,"$defs":{"id":{"type":"string","minLength":1,"maxLength":256,"pattern":"^[A-Za-z0-9][A-Za-z0-9._:/#@+-]*$"},"uri":{"type":"string","minLength":1,"format":"uri-reference"},"digest":{"type":"object","required":["algorithm","value"],"properties":{"algorithm":{"const":"sha256"},"value":{"type":"string","pattern":"^[A-Fa-f0-9]{64}$"}},"additionalProperties":false},"actor":{"type":"object","required":["ref","type"],"properties":{"ref":{"$ref":"#/$defs/uri"},"type":{"enum":["human","agent","mcp_client","mcp_server","service","policy_engine","verifier"]},"display_name":{"type":"string","minLength":1,"maxLength":200}},"additionalProperties":false},"artifact":{"type":"object","required":["ref","media_type","digest"],"properties":{"ref":{"$ref":"#/$defs/uri"},"media_type":{"type":"string","minLength":1,"maxLength":200},"digest":{"$ref":"#/$defs/digest"},"classification":{"enum":["public","internal","confidential","restricted"],"default":"internal"},"redacted":{"type":"boolean","default":false}},"additionalProperties":false},"intent":{"type":"object","required":["request_ref","initiator","code"],"properties":{"request_ref":{"$ref":"#/$defs/uri"},"initiator":{"$ref":"#/$defs/actor"},"code":{"type":"string","pattern":"^[A-Z][A-Z0-9_]*$","maxLength":128},"summary":{"type":"string","minLength":1,"maxLength":2000},"interpretation_ref":{"$ref":"#/$defs/uri"},"constraints":{"type":"array","items":{"type":"string","minLength":1,"maxLength":500},"uniqueItems":true}},"additionalProperties":false},"authorization":{"type":"object","required":["decision","scope"],"properties":{"decision":{"enum":["authorized","denied","not_required","unknown"]},"scope":{"type":"object","required":["action","resource"],"properties":{"action":{"type":"string","minLength":1,"maxLength":256},"resource":{"type":"string","minLength":1,"maxLength":1024},"constraints":{"type":"array","items":{"type":"string","minLength":1,"maxLength":500},"uniqueItems":true}},"additionalProperties":false},"approval_refs":{"type":"array","items":{"$ref":"#/$defs/uri"},"uniqueItems":true},"policy_refs":{"type":"array","items":{"$ref":"#/$defs/uri"},"uniqueItems":true},"actor":{"$ref":"#/$defs/actor"},"expires_at":{"type":"string","format":"date-time"}},"additionalProperties":false},"decision":{"type":"object","required":["code","maker","reason_codes"],"properties":{"code":{"type":"string","pattern":"^[A-Z][A-Z0-9_]*$","maxLength":128},"maker":{"$ref":"#/$defs/actor"},"reason_codes":{"type":"array","items":{"type":"string","pattern":"^[A-Z][A-Z0-9_]*$","maxLength":128},"minItems":1,"uniqueItems":true},"record_ref":{"$ref":"#/$defs/uri"},"summary":{"type":"string","minLength":1,"maxLength":2000,"description":"Externally auditable summary only; never private chain-of-thought."}},"additionalProperties":false},"dispatch":{"type":"object","required":["executor","server_ref","tool_name","protocol_version","request_digest","started_at"],"properties":{"executor":{"$ref":"#/$defs/actor"},"server_ref":{"$ref":"#/$defs/uri"},"tool_name":{"type":"string","minLength":1,"maxLength":256},"protocol_version":{"type":"string","pattern":"^20[0-9]{2}-[0-9]{2}-[0-9]{2}$"},"request_ref":{"$ref":"#/$defs/uri"},"request_digest":{"$ref":"#/$defs/digest"},"tool_schema_digest":{"$ref":"#/$defs/digest"},"correlation_id":{"$ref":"#/$defs/id"},"idempotency_key":{"type":"string","minLength":1,"maxLength":256},"started_at":{"type":"string","format":"date-time"},"completed_at":{"type":"string","format":"date-time"}},"additionalProperties":false},"action":{"type":"object","required":["side_effect","dispatch"],"properties":{"side_effect":{"enum":["read_only","local_write","external_write","destructive","unknown"]},"blast_radius":{"enum":["none","single_resource","bounded","unbounded","unknown"]},"dispatch":{"oneOf":[{"type":"null"},{"$ref":"#/$defs/dispatch"}]}},"additionalProperties":false},"postcondition":{"type":"object","required":["id","language","expression","severity"],"properties":{"id":{"$ref":"#/$defs/id"},"language":{"enum":["cel","jsonpath","json_schema","rego","sql","human_review"]},"expression":{"oneOf":[{"type":"string","minLength":1,"maxLength":5000},{"type":"object"}]},"severity":{"enum":["info","warning","error","critical"]},"evidence_refs":{"type":"array","items":{"$ref":"#/$defs/uri"},"uniqueItems":true}},"additionalProperties":false},"outcome":{"type":"object","required":["status","observed_at"],"properties":{"status":{"enum":["succeeded","failed","partial","cancelled","timed_out","unknown"]},"result_type":{"type":"string","minLength":1,"maxLength":128},"response_ref":{"$ref":"#/$defs/uri"},"response_digest":{"$ref":"#/$defs/digest"},"error_code":{"type":"string","minLength":1,"maxLength":256},"observed_at":{"type":"string","format":"date-time"}},"additionalProperties":false},"verification":{"type":"object","required":["verdict","independence","checks"],"properties":{"verdict":{"enum":["verified","diverged","inconclusive","not_performed"]},"independence":{"enum":["independent","same_actor","not_assessed"]},"verifier":{"$ref":"#/$defs/actor"},"checks":{"type":"array","items":{"type":"object","required":["id","postcondition_id","result"],"properties":{"id":{"$ref":"#/$defs/id"},"postcondition_id":{"$ref":"#/$defs/id"},"result":{"enum":["pass","fail","unknown","not_applicable"]},"evidence_refs":{"type":"array","items":{"$ref":"#/$defs/uri"},"uniqueItems":true}},"additionalProperties":false}},"verified_at":{"type":"string","format":"date-time"}},"allOf":[{"if":{"required":["independence"],"properties":{"independence":{"const":"independent"}}},"then":{"required":["verifier"]}},{"if":{"required":["verdict"],"properties":{"verdict":{"enum":["verified","diverged"]}}},"then":{"properties":{"checks":{"minItems":1}},"required":["verified_at"]}}],"additionalProperties":false},"recovery":{"type":"object","required":["reversibility","status"],"properties":{"reversibility":{"enum":["reversible","compensatable","irreversible","unknown"]},"status":{"enum":["not_required","available","contained","recovering","recovered","failed"]},"rollback_tool":{"type":"string","minLength":1,"maxLength":256},"containment_deadline":{"type":"string","format":"date-time"},"action_refs":{"type":"array","items":{"$ref":"#/$defs/uri"},"uniqueItems":true}},"additionalProperties":false},"time":{"type":"object","required":["valid_time","recorded_time"],"properties":{"valid_time":{"type":"string","format":"date-time"},"recorded_time":{"type":"string","format":"date-time"},"source_clock":{"type":"string","minLength":1,"maxLength":256}},"additionalProperties":false},"integrity":{"type":"object","required":["record_digest","parent_digests","canonicalization","digest_coverage"],"properties":{"record_digest":{"$ref":"#/$defs/digest"},"parent_digests":{"type":"object","propertyNames":{"pattern":"^[A-Za-z0-9][A-Za-z0-9._:/#@+-]*$"},"additionalProperties":{"$ref":"#/$defs/digest"}},"canonicalization":{"const":"caep-json-v1"},"digest_coverage":{"const":"all fields except integrity.record_digest and integrity.signature"},"signature":{"type":"object","required":["algorithm","key_id","value"],"properties":{"algorithm":{"enum":["ed25519","ecdsa-p256-sha256","rsa-pss-sha256"]},"key_id":{"$ref":"#/$defs/uri"},"value":{"type":"string","minLength":1}},"additionalProperties":false}},"additionalProperties":false},"privacy":{"type":"object","properties":{"classification":{"enum":["public","internal","confidential","restricted"]},"contains_personal_data":{"type":"boolean"},"redacted_paths":{"type":"array","items":{"type":"string","minLength":1,"maxLength":500},"uniqueItems":true},"retention_until":{"type":"string","format":"date-time"}},"additionalProperties":false}}}