{"profile":"org.causal-memory-layer.caep","schema_version":"0.1.0","episode_id":"caep_diverged_01","workflow_id":"workflow_duplicate_payment_123","status":"contained","causal_parent_ids":[],"supersedes":[],"intent":{"request_ref":"urn:request:43","initiator":{"ref":"urn:actor:user:alex","type":"human","display_name":"Alex"},"code":"PAY_ORDER_IF_UNPAID","summary":"Pay order 88 only if it has not already been paid.","constraints":["maximum_one_successful_payment"]},"authorization":{"decision":"authorized","scope":{"action":"payments.create","resource":"urn:order:order-88","constraints":["reported_payment_status == unpaid","state_age_seconds <= 5"]},"approval_refs":["urn:approval:892"],"policy_refs":["urn:policy:payments-v3"],"actor":{"ref":"urn:actor:policy-engine:main","type":"policy_engine"},"expires_at":"2026-07-29T17:10:30Z"},"decision":{"code":"EXECUTE_AUTHORIZED_TRANSITION","maker":{"ref":"urn:actor:agent:orchestrator","type":"agent"},"reason_codes":["USER_REQUEST_CONFIRMED","POLICY_CHECK_PASSED","STALE_STATE_NOT_DETECTED"],"record_ref":"urn:decision:18","summary":"A stale unpaid observation incorrectly permitted a second payment dispatch."},"state_before":[{"ref":"urn:artifact:stale-unpaid-state","media_type":"application/json","digest":{"algorithm":"sha256","value":"6666666666666666666666666666666666666666666666666666666666666666"},"classification":"confidential"}],"action":{"side_effect":"external_write","blast_radius":"single_resource","dispatch":{"executor":{"ref":"urn:actor:mcp-server:payments","type":"mcp_server"},"server_ref":"urn:mcp-server:payments.example","tool_name":"create_payment","protocol_version":"2026-07-28","request_ref":"urn:artifact:tool-request-18","request_digest":{"algorithm":"sha256","value":"7777777777777777777777777777777777777777777777777777777777777777"},"tool_schema_digest":{"algorithm":"sha256","value":"2222222222222222222222222222222222222222222222222222222222222222"},"correlation_id":"corr_18","idempotency_key":"payment_43_attempt_1","started_at":"2026-07-29T17:10:00Z","completed_at":"2026-07-29T17:10:02Z"}},"expected_postconditions":[{"id":"single_successful_payment","language":"cel","expression":"payments.filter(p, p.order_id == 'order-88' && p.status == 'succeeded').size() == 1","severity":"critical","evidence_refs":["urn:artifact:ledger-two-payments"]}],"outcome":{"status":"succeeded","result_type":"completed","response_ref":"urn:artifact:tool-response-18","response_digest":{"algorithm":"sha256","value":"8888888888888888888888888888888888888888888888888888888888888888"},"observed_at":"2026-07-29T17:10:03Z"},"state_after":[{"ref":"urn:artifact:ledger-two-payments","media_type":"application/json","digest":{"algorithm":"sha256","value":"9999999999999999999999999999999999999999999999999999999999999999"},"classification":"confidential"}],"verification":{"verdict":"diverged","independence":"independent","verifier":{"ref":"urn:actor:verifier:ledger-reader","type":"verifier"},"checks":[{"id":"check_duplicate_18","postcondition_id":"single_successful_payment","result":"fail","evidence_refs":["urn:artifact:ledger-two-payments"]}],"verified_at":"2026-07-29T17:10:04Z"},"recovery":{"reversibility":"compensatable","status":"contained","rollback_tool":"cancel_payment","containment_deadline":"2026-07-29T17:10:30Z","action_refs":["urn:tool-call:lock-order-payment-attempts-18"]},"time":{"valid_time":"2026-07-29T17:10:02Z","recorded_time":"2026-07-29T17:10:05Z","source_clock":"payments.example"},"integrity":{"record_digest":{"algorithm":"sha256","value":"646b823fed85c726c32fb3edf1133946df909bb826888db2b582e43358dcec73"},"parent_digests":{},"canonicalization":"caep-json-v1","digest_coverage":"all fields except integrity.record_digest and integrity.signature"},"privacy":{"classification":"confidential","contains_personal_data":true,"redacted_paths":["/state_before/0","/state_after/0"],"retention_until":"2027-07-29T00:00:00Z"},"extensions":{"org.causal-memory-layer.orientation":{"center":{"successful_payment_count":1,"duplicate_payment_count":0,"independently_verified":true},"orientation_center_reached":false}}}